developing,ZAF ,710,South Africa,South Africa,South Africa1998,0,1998,1998.75,15-49,MW,56.3,55.1,1.2,,,,,Including folk methods.,,,,,Including folk methods.,16.5,5.7,10.8,,DHS,,South Africa Demographic and Health Survey 1998,1721
developing,ZAF ,710,South Africa,South Africa,South Africa2003,0,2003.75,2004.67,15-49,MW,59.9,59.8,0,,,,,,,,,,,13.8,4.7,9.1,,DHS,,South Africa Demographic and Health Survey 2003,1720
developing,SSD,728,South Sudan,South Sudan,South Sudan2006,0,2006,2007,15-49,MW,3.5,3.3,0.2,,,Estimate.,,,,,,,,,,,,National survey,,The Sudan Household Health Survey (SHHS) - 2006,5240
developing,SSD,728,South Sudan,South Sudan,South Sudan2010,0,2010.24,2010.49,15-49,MW,4,1.7,2.3,,,,,,,,,,,26.3,19.1,7.2,,MICS3,,South Sudan Household Survey 2010,5560
,ESP ,724,Spain,Spain,Spain1977,0,1977.83,1978,18-49,MW,47.1,18.6,25.8,,,Figures by method do not add up to the total.,,Including abstinence.,,,,,,,,,,National survey,,Encuesta de Fecundidad de 1977,4970
,ESP ,724,Spain,Spain,Spain1985,0,1985,1986,18-49,MW,59.4,38,21.5,,,,,Including abstinence.,,,,,,,,,,National survey,,Encuesta de Fecundidad de 1985,2756
,ESP ,724,Spain,Spain,Spain1994,0,1994.83,1995.91,20-49,MW,81.1,67.4,13.6,,Data pertain to women who were sexually active during the month prior to the interview.,Including some cases of sterilization for non-contraceptive reasons.,,Including abstinence.,,Data pertain to women who were sexually active during the month prior to the interview.,,+,,11.8,6.3,5.4,,FFS,,Encuesta de Fecundidad y Familia,2860
,ESP ,724,Spain,Spain,Spain1999,0,1999,2000,15-49,MW,71.7,66,5.7,,,,,,,,,,,,,,,National survey,,Encuesta de Fecundidad de 1999,2890
,ESP ,724,Spain,Spain,Spain2006,0,2006,2007,15-49,MW,65.7,62.3,3.5,,,,,,,,,,,,,,,National survey,,Encuesta de Fecundidad y Valores 2006,3309
developing,LKA ,144,Sri Lanka,Sri Lanka,Sri Lanka1975,0,1975,1976,15-49,MW,34.4,20.2,14.2,Excluding the Northern and Eastern Province.,,,,Including abstinence.,Excluding the Northern and Eastern Province.,,,,,,,,,WFS,,The Sri Lanka Fertility Survey 1975,174
developing,LKA ,144,Sri Lanka,Sri Lanka,Sri Lanka1977,0,1977,1978,15-49,MW,48.6,26.9,21.7,,,,,,,,,,,,,,,National survey,,Family Health Impact Survey 1977,5173
developing,LKA ,144,Sri Lanka,Sri Lanka,Sri Lanka1981,0,1981,1983,15-49,MW,47.7,33.7,14,Excluding the Northern and Eastern Province.,,,,Including abstinence.,Excluding the Northern and Eastern Province.,,,,,,,,,National survey,,Family Health Impact Survey 1981-1982,5174
developing,LKA ,144,Sri Lanka,Sri Lanka,Sri Lanka1982,0,1982,1983,15-49,MW,57.8,31.9,26,Excluding the Northern and Eastern Province.,,,Including injectables and vaginal barrier methods.,Including abstinence.,Excluding the Northern and Eastern Province.,,,,,,,,,CPS,,Sri Lanka Contraceptive Prevalence Survey 1982 ,2732
developing,LKA ,144,Sri Lanka,Sri Lanka,Sri Lanka1987,0,1987,1987.24,15-49,MW,61.7,40.6,21.1,Excluding the Northern and Eastern Province.,,,Including injectables and vaginal barrier methods.,Including abstinence.,Excluding the Northern and Eastern Province.,,,,,12.3,7.2,5.1,,DHS,,Sri Lanka Demographic and Health Survey 1987,1718
developing,LKA ,144,Sri Lanka,Sri Lanka,Sri Lanka1993,0,1993,1994,15-49,MW,66.1,43.7,22.4,Excluding the Northern and Eastern Province.,,,,Including abstinence.,Excluding the Northern and Eastern Province.,,,,,,,,,National survey,,Sri Lanka Demographic and Health Survey 1993,2833
developing,LKA ,144,Sri Lanka,Sri Lanka,Sri Lanka2000,0,2000.33,2000.67,15-49,MW,70,49.6,20.4,,,,,Including abstinence.,,,,,,18.2,6.2,12,,National survey,,Sri Lanka Demographic and Health Survey 2000,2902
developing,LKA ,144,Sri Lanka,Sri Lanka,Sri Lanka2006,0,2006.67,2007.83,15-49,MW,68.4,52.5,16,Excluding the Northern Province.,,,,Including folk methods.,Excluding the Northern Province.,,,,Including folk methods.,7.3,3.5,3.8,,DHS,,Sri Lanka Demographic and Health Survey 2006-2007,4553
developing,PSE ,275,State of Palestine,State of Palestine,State of Palestine1996,0,1996,1997,15-49,MW,45.2,30.7,14.5,,,,,,,,,,,,,,,National survey,,Palestinian Health Survey 1996,2867
developing,PSE ,275,State of Palestine,State of Palestine,State of Palestine2000,0,2000,2001,15-49,MW,51.4,36.7,14.8,,,,,Including breastfeeding.,,,,,,,,,,National survey,,Palestinian Health Survey 2000,813
developing,PSE ,275,State of Palestine,State of Palestine,State of Palestine2004,0,2004.38,2004.52,15-49,MW,50.6,37.3,13.3,,,,,Including breastfeeding.,,,,,,,,,,National survey,,Palestinian Demographic and Health Survey 2004,807
developing,PSE ,275,State of Palestine,State of Palestine,State of Palestine2006,0,2006.83,2007.05,15-49,MW,50.2,38.9,11.3,,,,"Including male and female sterilization, male and female condoms, emergency contraception, injectables, implants and vaginal barrier methods.","Including breastfeeding, rhythm and withdrawal.",,,,,,,,,,PAPFAM,,Palestinian Family Health Survey 2006,823
developing,PSE ,275,State of Palestine,State of Palestine,State of Palestine2010,0,2010.33,2010.75,15-49,MW,52.5,44.2,8.3,,,,,,,,,,,15.6,10.4,5.3,,MICS,,Palestinian Family Survey 2010,5019
developing,PSE ,275,State of Palestine,State of Palestine,State of Palestine2014,0,2013.83,2014.33,15-49,MW,57.2,44.1,13.1,,,Figures by method do not add up to the total.,,,,,,,,10.9,6.3,4.6,,MICS,,Palestinian Multiple Indicator Cluster Survey 2014,5563
developing,SDN,729,Sudan,Sudan,Sudan1978,0,1978,1980,15-50,MW,4.6,3.9,0.7,Data pertain to pre-secession Northern Sudan.,,Figures by method do not add up to the total.,,,Data pertain to pre-secession Northern Sudan.,,,,,,,,,WFS,,Sudan Fertility Survey 1979,5212
developing,SDN,729,Sudan,Sudan,Sudan1989,0,1989.83,1990.41,15-49,MW,8.7,5.6,3.1,Data pertain to pre-secession Northern Sudan.,,,,,Data pertain to pre-secession Northern Sudan.,,,,,28.9,15.5,13.4,,DHS,,Sudan Demographic and Health Survey 1989-1990,5219
developing,SDN,729,Sudan,Sudan,Sudan1992,0,1992,1994,15-49,MW,9.9,6.9,3,Data pertain to pre-secession Northern Sudan.,,,"Including male and female sterilization, injectables, male condoms and vaginal barrier methods.","Including breastfeeding, rhythm and withdrawal.",Data pertain to pre-secession Northern Sudan.,,,,,26,,,,PAPCHILD,,Sudan Maternal and Child Health Survey 1992-1993,5220
developing,SDN,729,Sudan,Sudan,Sudan1999,0,1999.33,1999.41,15-49,MW,7,5.4,2,Data pertain to pre-secession Northern Sudan.,,Figures by method do not add up to the total.,,,Data pertain to pre-secession Northern Sudan.,,,,,,,,,National survey,,Sudan National Safe Motherhood Survey 1999,5215
developing,SDN,729,Sudan,Sudan,Sudan2006,0,2006,2007,15-49,MW,9.452180394,9,0.4,Data pertain to pre-secession Northern Sudan.,,Estimate.,,,Data pertain to pre-secession Northern Sudan.,,,,,,,,,National survey,,The Sudan Household Health Survey (SHHS) - 2006,5223
developing,SDN,729,Sudan,Sudan,Sudan2010,0,2010.5,2010.91,15-49,MW,9,,,"Data pertain to pre-secession Sudan, including data for South Sudan.",,,,,"Data pertain to pre-secession Sudan, including data for South Sudan.",,,,,28.9,18.4,10.5,,MICS,,The Sudan Household Health Survey Second Round (SHHS2) - 2010,5355
developing,SDN,729,Sudan,Sudan,Sudan2014,0,2014.69,2014.85,15-49,MW,12.2,11.7,0.5,,,,,,,,,,,26.6,19.1,7.5,,MICS,,Sudan 2014 Multiple Indicator Cluster Survey,5593
developing,SUR ,740,Suriname,Suriname,Suriname1992,0,1992,1993,15-44,AL,48,46.6,1.4,,"Data pertain to all women of reproductive age, irrespective of marital status.",,,,,,,,,,,,,National survey,,1992 Contraceptive Prevalence Survey,2826
developing,SUR ,740,Suriname,Suriname,Suriname1999,0,1999.83,2000.33,15-49,MW,42.1,40.7,1.4,,,,,,,,,,,,,,,MICS2,,Suriname Multiple Indicator Cluster Survey,1945
developing,SUR ,740,Suriname,Suriname,Suriname2006,0,2006.25,2006.41,15-49,MW,45.6,45,0.6,,,,,,,,,,,,,,,MICS3,,Suriname Multiple Indicator Cluster Survey,1919
developing,SUR ,740,Suriname,Suriname,Suriname2010,0,2010.52,2010.55,15-49,MW,47.6,47.2,0.4,,,,Figures on other modern and other traditional methods are combined.,,,,,,,16.9,7.7,9.1,,MICS,,Suriname 2010 Multiple Indicator Cluster Survey,5030
developing,SWZ ,748,Swaziland,Swaziland,Swaziland1988,0,1988.75,1989.01,15-49,MW,19.8,17.1,2.8,,Including single women who have borne a child.,,,,,,,,,,,,,RHS,,Swaziland Family Health Survey,2791
developing,SWZ ,748,Swaziland,Swaziland,Swaziland2000,0,2000.5,2000.75,15-49,MW,27.7,26.1,1.6,,,,,,,,,,,,,,,MICS2,,Swaziland Multiple Indicator Cluster Survey 2000,1931
developing,SWZ ,748,Swaziland,Swaziland,Swaziland2002,0,2002,2003,15-49,AL,40.1,38.6,1.5,,"Data pertain to all women of reproductive age, irrespective of marital status.",,Including male sterilization and implants.,,,,,,,,,,,National survey,,Swaziland 2002 Community Health Survey,2926
developing,SWZ ,748,Swaziland,Swaziland,Swaziland2006,0,2006.5,2007.16,15-49,MW,50.6,47.7,2.9,,,,,Including folk methods.,,,,,Including folk methods.,24.7,6.7,18.1,,DHS,,Swaziland Demographic and Health Survey 2006-2007,1695
developing,SWZ ,748,Swaziland,Swaziland,Swaziland2010,0,2010.61,2010.9,15-49,MW,65.2,63.1,2,,,,,,,,,,,13,5.5,7.5,,MICS4,,Swaziland Multiple Indicator Cluster Survey 2010,5031
developing,SWZ ,748,Swaziland,Swaziland,Swaziland2014,0,2014.53,2014.79,15-49,MW,66.1,65.5,0.6,,,,,,,,,,,15.2,,,,MICS5,,Swaziland Multiple Indicator Cluster Survey 2014,5584
,SWE ,752,Sweden,Sweden,Sweden1981,0,1981,1982,20-44,SA,78,72,6,,Data pertain to sexually active women of reproductive age.,,"Including male and female sterilization, male condoms, injectables, implants and vaginal barrier methods.","Including abstinence, rhythm and withdrawal.",,Data pertain to sexually active women of reproductive age.,,,,,,,,National survey,,Fertility Survey in Sweden 1981,2722
,SWE ,752,Sweden,Sweden,Sweden1996,0,1996,1997,18-44,SA,75.2,64.8,10.4,,Data pertain to women who have ever had sex.,Data pertain to methods used at last sex.,Including male and female sterilization.,,,,,,,,,,,National survey,,National Survey on Sexual Behavior in Sweden (Sex i Sverige) 1996,2868
,CHE ,756,Switzerland,Switzerland,Switzerland1980,0,1980,1981,See notes,HW,71.2,64.9,6.4,,Data pertain to a sample of husbands and wives married between 1970 and 1979.,,Including male and female sterilization.,,,,,,,,,,,National survey,,Survey of contraceptive behaviour among Swiss couples,2706
,CHE ,756,Switzerland,Switzerland,Switzerland1994,0,1994.75,1995.41,20-49,MW,82,77.5,4.5,,,Including some cases of sterilization for non-contraceptive reasons.,,,,,,+,,,,,,FFS,,Enquête Suisse sur la Famille 1994-1995,2846
,CHE ,756,Switzerland,Switzerland,Switzerland2012,0,2012,2013,15-49,MW,72.9033,69.2033,3.7,,,,,,,,,,,,,,,National survey,,Switzerland 2012 Health Survey,6018
developing,SYR ,760,Syrian Arab Republic,Syrian Arab Republic,Syrian Arab Republic1978,0,1978,1979,<50,MW,29.5,22.4,7,,Data pertain to women exposed to the risk of pregnancy.,,,Including abstinence and douching.,,Data pertain to women exposed to the risk of pregnancy.,,,,,,,,WFS,,The Syrian Fertility Survey 1978,125
developing,SYR ,760,Syrian Arab Republic,Syrian Arab Republic,Syrian Arab Republic1993,0,1993,1994,15-49,MW,39.6,28.3,11.3,,,,,Including breastfeeding.,,,,,,,,,,PAPCHILD,,Syrian Maternal and Child Health Survey 1993,663
developing,SYR ,760,Syrian Arab Republic,Syrian Arab Republic,Syrian Arab Republic2001,0,2001.83,2001.95,15-49,MW,46.6,35.1,11.5,,,,,Including breastfeeding.,,,,,,,,,,PAPFAM,,Family Health Survey in the Syrian Arab Republic 2001,147
developing,SYR ,760,Syrian Arab Republic,Syrian Arab Republic,Syrian Arab Republic2006,0,2006.33,2006.49,15-49,MW,58.3,46.6,11.7,,,,,,,,,,,,,,,MICS3,,Syrian Arab Republic Multiple Indicator Cluster Survey  2006,51
developing,SYR ,760,Syrian Arab Republic,Syrian Arab Republic,Syrian Arab Republic2009,0,2009,2011,15-49,MW,53.9,37.5,16.4,,,Figures by method do not add up to the total.,,Including breastfeeding.,,,,,,16.4,11.5,4.9,,PAPFAM,,Syrian Arab Republic 2009-2010 Family Health Survey ,5399
developing,TJK ,762,Tajikistan,Tajikistan,Tajikistan2000,0,2000.51,2000.59,15-49,MW,33.9,28.3,5.6,,,,,,,,,,,,,,,MICS2,,Tajikistan Multiple Indicator Cluster Survey 2000,1924
developing,TJK ,762,Tajikistan,Tajikistan,Tajikistan2005,0,2005.67,2005.83,15-49,MW,37.9,36.2,1.8,,,,,,,,,,,,,,,MICS3,,Tajikistan Multiple Indicator Cluster Survey 2005,724
developing,TJK ,762,Tajikistan,Tajikistan,Tajikistan2007,0,2007,2008,15-49,MW,37.1,31.7,5.5,,,,Including male and female sterilization.,Including abstinence and douching.,,,,,,,,,,LSMS,,Tajikistan Living Standards Survey 2007,5176
developing,TJK ,762,Tajikistan,Tajikistan,Tajikistan2012,0,2012.5,2012.75,15-49,MW,27.9,25.8,2.1,,,Figures by method do not add up to the total.,,,,,,,,22.9,11.8,11,,DHS,,Tajikistan Demographic and Health Survey 2012,5070
developing,THA ,764,Thailand,Thailand,Thailand1969,0,1969.25,1970.41,15-44,MW,14.8,14.8,,,,,,,,,,,,,,,,National survey,,"National Longitudinal Study of Social, Economic and Demographic Change 1969-1970",3319
developing,THA ,764,Thailand,Thailand,Thailand1972,0,1972.25,1973.41,15-44,MW,26.3,25.7,0.6,,,,,Including rhythm and withdrawal.,,,,,,,,,,National survey,,"National Longitudinal Study of Social, Economic and Demographic Change 1972-1973",4643
developing,THA ,764,Thailand,Thailand,Thailand1975,0,1975.25,1975.41,15-44,MW,36.7,33.9,2.9,,,,,"Including rhythm, withdrawal, abstinence and douching.",,,,,,,,,,WFS,,The Survey of Fertility in Thailand 1975,702
developing,THA ,764,Thailand,Thailand,Thailand1978,0,1978.92,1979.08,15-44,MW,53.4,49.3,4.1,,,,,Including rhythm and withdrawal.,,,,,,,,,,National survey,,Thailand Contraceptive Prevalence Survey 1978,4644
developing,THA ,764,Thailand,Thailand,Thailand1981,0,1981.23,1981.44,15-44,MW,59,56.3,2.7,,,,,Including rhythm and withdrawal.,,,,,,,,,,National survey,,Thailand Contraceptive Prevalence Survey 1981,105
developing,THA ,764,Thailand,Thailand,Thailand1984,0,1984,1985,15-44,MW,64.6,62,2.6,,,,,,,,,,,,,,,National survey,,Thailand Contraceptive Prevalence Survey 1984,193
developing,THA ,764,Thailand,Thailand,Thailand1987,0,1987.16,1987.49,15-49,MW,65.5,63.6,1.9,,,,,Including folk methods.,,,,,Including folk methods.,11.1,5.6,5.5,,DHS,,Thai Demographic and Health Survey 1987,1783
developing,THA ,764,Thailand,Thailand,Thailand1989,0,1989,1990,15-44,MW,66.2,64.2,2,,,Adjusted.,,,,,,,,,,,,National survey,,Survey of Population Change 1989,25
developing,THA ,764,Thailand,Thailand,Thailand1993,0,1993,1994,15-44,MW,73.9,72.2,1.9,,,Figures by method do not add up to the total.,,,,,,,,,,,,National survey,,Survey on the Status of Women and Fertility in Thailand,2834
developing,THA ,764,Thailand,Thailand,Thailand1995,0,1995,1997,15-44,MW,75.2,73.8,1.4,,,Adjusted.,,,,,,,,,,,,National survey,,Survey of Population Change 1995-1996,788
developing,THA ,764,Thailand,Thailand,Thailand1996,0,1996,1998,15-44,MW,72.2,69.8,2.4,,,,,,,,,,,,,,,National survey,,Thailand Contraceptive Prevalence Survey 1996,2869
developing,THA ,764,Thailand,Thailand,Thailand2001,0,2001,2002,15-49,MW,77.8,76.1,1.6,,,,,,,,,,,,,,,National survey,,"Economic Crisis, Demographic Dynamics and Family in Thailand",5178
developing,THA ,764,Thailand,Thailand,Thailand2005,0,2005,2007,15-49,MW,73.8,72.5,1.3,,,,,,,,,,,,,,,National survey,,2005-2006 Survey Population Change,111
developing,THA ,764,Thailand,Thailand,Thailand2005,0,2005.92,2006.16,15-49,MW,71.5,70.1,1.4,,,Adjusted.,,,,,,,,,,,,MICS3,,Thailand Multiple Indicator Cluster Survey 2005,175
developing,THA ,764,Thailand,Thailand,Thailand2006,0,2006,2007,15-49,MW,81.1,79.8,1.3,,,,,,,,,,,3.1,,,,National survey,,2006 Reproductive Health Survey,5179
developing,THA ,764,Thailand,Thailand,Thailand2009,0,2009,2010,15-49,MW,79.6,77.5,2.2,,,,,,,,,,,,,,,National survey,,The 2009 Reproductive Health Survey,5400
developing,THA ,764,Thailand,Thailand,Thailand2012,0,2012.67,2012.92,15-49,MW,79.3,76.9,2.4,,,,,,,,,,,6.9,2.7,4.2,,MICS,,Thailand 2012 Multiple Indicator Cluster Survey,5034
,MKD ,807,The former Yugoslav Republic of Macedonia,The former Yugoslav Republic of Macedonia,The former Yugoslav Republic of Macedonia1970,0,1970,1971,15-44,AL,43.2,3.1,40.1,,"Data pertain to all women of reproductive age, irrespective of marital status.",Data pertain to methods used during  the last two months.,,,,,,,,,,,,National survey,,1970 Yugoslavia Fertility Survey,5180
,MKD ,807,The former Yugoslav Republic of Macedonia,The former Yugoslav Republic of Macedonia,The former Yugoslav Republic of Macedonia2011,0,2011.25,2011.08,15-49,MW,40.2,12.8,27.4,,,,Figures on other modern and other traditional methods are combined.,,,,,,,17.2,5.3,11.8,,MICS,,Macedonia Multiple Indicator Cluster Survey 2011,5035
developing,TLS,626,Timor-Leste,Timor-Leste,Timor-Leste1991,0,1991.33,1991.5,15-49,MW,25.1,20.4,4.7,,,,,Including folk methods.,,,,,Including folk methods.,18.3,11.5,6.7,,DHS,,Indonesia Demographic and Health Survey 1991,2810
developing,TLS,626,Timor-Leste,Timor-Leste,Timor-Leste1994,0,1994.5,1994.83,15-49,MW,22.6,20.7,1.9,,,,,,,,,,,13.3,8.3,5,,DHS,,Indonesia Demographic and Health Survey 1994,2838
developing,TLS,626,Timor-Leste,Timor-Leste,Timor-Leste1997,0,1997.67,1997.92,15-49,MW,26.7,25.1,1.6,,,,,,,,,,,17.4,11.4,5.9,,DHS,,Indonesia Demographic and Health Survey 1997,2874
developing,TLS,626,Timor-Leste,Timor-Leste,Timor-Leste2001,0,2001,2002,15-49,MW,8,6.6,1.3,,,,,Including folk methods.,,,,,Including folk methods.,,,,,LSMS,,Timor-Leste Survey of Living Standards 2001,2013
developing,TLS,626,Timor-Leste,Timor-Leste,Timor-Leste2003,0,2003.32,2003.65,15-49,MW,10,8.6,1.3,,,,,,,,,,,3.8,3.7,0.1,,National survey,,Timor-Leste 2003 Demographic and Health Survey,18
developing,TLS,626,Timor-Leste,Timor-Leste,Timor-Leste2007,0,2007,2008,15-49,MW,19.8,15.8,4,,,,,Including folk methods.,,,,,Including folk methods.,,,,,LSMS,,Timor-Leste Survey of Living Standards 2007,5181
developing,TLS,626,Timor-Leste,Timor-Leste,Timor-Leste2009,0,2009.58,2010.16,15-49,MW,22.3,20.6,1.7,,,,,,,,,,,31.5,20.9,10.6,,DHS,,Timor-Leste Demographic and Health Survey 2009-2010,4948
developing,TGO ,768,Togo,Togo,Togo1988,0,1988.42,1988.92,15-49,MW,33.9,3.1,30.8,,,,,Including abstinence and folk methods.,,,,,Including abstinence and folk methods.,40.1,28.5,11.7,,DHS,,Enquête Démographique et de Santé au Togo 1988,1946
developing,TGO ,768,Togo,Togo,Togo1998,0,1998.08,1998.41,15-49,MW,23.5,7,16.5,,,,,Including abstinence and folk methods.,,,,,Including abstinence and folk methods.,35,23.6,11.4,,DHS,,Enquête Démographique et de Santé au Togo 1998,1735
developing,TGO ,768,Togo,Togo,Togo2000,0,2000,2001,15-49,MW,25.7,13.3,12.4,,,,,Including abstinence.,,,,,,,,,,MICS2,,Enquête Nationale à Indicateurs Multiples Togo 2000,2903
developing,TGO ,768,Togo,Togo,Togo2006,0,2006.35,2006.48,15-49,MW,16.8,11.6,5.2,,,,,,,,,,,,,,,MICS3,,Enquête Nationale à Indicateurs Multiples Togo 2006,669
developing,TGO ,768,Togo,Togo,Togo2010,0,2010.68,2010.84,15-49,MW,15.2,13.7,1.6,,,,,,,,,,,37.2,23.1,14.1,,MICS4,,Enquête par grappes à indicateurs multiples (MICS) 2010,5036
developing,TGO ,768,Togo,Togo,Togo2013,0,2013.83,2014.33,15-49,MW,19.9,17.2,2.6,,,,,,,,,,,33.6,21.8,11.8,,DHS,,Togo 2013-2014 Demographic and Health Survey and MICS,5071
developing,TON,776,Tonga,Tonga,Tonga2012,0,2012,2013,15-49,MW,34.1,28.4,5.7,,,,,Including folk methods.,,,,,Including folk methods.,25.2,13.2,12,,National survey,,Tonga Demographic and Health Survey 2012,5448
developing,TTO ,780,Trinidad and Tobago,Trinidad and Tobago,Trinidad and Tobago1970,0,1970,1972,15-44,MW,43.6,36.5,9.2,,,Figures by method do not add up to the total because some methods are used in combination.,,Including abstinence.,,,,,,,,,,National survey,,Family Planning Survey,5182
developing,TTO ,780,Trinidad and Tobago,Trinidad and Tobago,Trinidad and Tobago1977,0,1977,1978,15-49,MW,60.2,53.4,6.8,,Data pertain to women exposed to the risk of pregnancy.,,,Including abstinence and douching.,,Data pertain to women exposed to the risk of pregnancy.,,,,,,,,WFS,,Trinidad and Tobago Fertility Survey 1977,126
developing,TTO ,780,Trinidad and Tobago,Trinidad and Tobago,Trinidad and Tobago1987,0,1987.33,1987.66,15-49,MW,52.7,44.4,8.2,,,,,Including douching and folk methods.,,,,,Including douching and folk methods.,16.1,8.3,7.9,,DHS,,Trinidad and Tobago Demographic and Health Survey 1987,1741
developing,TTO ,780,Trinidad and Tobago,Trinidad and Tobago,Trinidad and Tobago2000,0,2000.12,2000.21,15-49,MW,38.2,33.3,4.9,,,,,,,,,,,,,,,MICS2,,Trinidad and Tobago Multiple Indicator Cluster Survey,1938
developing,TTO ,780,Trinidad and Tobago,Trinidad and Tobago,Trinidad and Tobago2006,0,2006.3,2006.44,15-49,MW,42.5,38.1,4.4,,,,,,,,,,,26.7,6.3,20.4,,MICS3,,Trinidad and Tobago Multiple Indicator Cluster Survey,1915
developing,TUN ,788,Tunisia,Tunisia,Tunisia1978,0,1978,1979,15-49,MW,31.4,24.7,6.7,,,,,Including douching.,,,,,,,,,,WFS,,Enquête Tunisienne sur la Fécondité 1978,33
developing,TUN ,788,Tunisia,Tunisia,Tunisia1983,0,1983,1984,15-49,MW,41.1,34.2,6.9,,,,,,,,,,,,,,,CPS,,Enquête Tunisienne sur la Prévalence Contraceptive 1983,792
developing,TUN ,788,Tunisia,Tunisia,Tunisia1988,0,1988.42,1988.83,15-49,MW,49.8,40.4,9.4,,,,,,,,,,,,,,,DHS,,Enquête Démographique et de Santé en Tunisie 1988,1852
developing,TUN ,788,Tunisia,Tunisia,Tunisia1994,0,1994,1996,15-49,MW,60,51,9,,,,,,,,,,,,,,,PAPCHILD,,Tunisia Maternal and Child Health Survey 1994-1995,814
developing,TUN ,788,Tunisia,Tunisia,Tunisia2000,0,2000,2001,15-49,MW,65.5,57.7,7.8,,,,,Including breastfeeding.,,,,,,,,,,MICS2,,Tunisia Multiple Indicator Survey 2000,2904
developing,TUN ,788,Tunisia,Tunisia,Tunisia2001,0,2001.41,2001.66,15-49,MW,62.6,53.1,9.6,,,,Including male and female sterilization.,,,,,,,12.1,,,,PAPFAM,,The Tunisian Survey for Family Health 2001,743
developing,TUN ,788,Tunisia,Tunisia,Tunisia2006,0,2006.41,2006.66,15-49,MW,60.2,51.5,8.7,,,Adjusted.,,,,,,,,,,,,MICS3,,Enquête sur la santé et le bien être de la mère et l'enfant,2585
developing,TUN ,788,Tunisia,Tunisia,Tunisia2011,0,2011.92,2012.33,15-49,MW,62.5,50.9,11.6,,,,,,,,,,,7,3.7,3.3,,MICS,,Tunisia 2011-2012 Multiple Indicator Cluster Survey,5038
developing,TUR ,792,Turkey,Turkey,Turkey1963,0,1963,1964,<45,MW,22.1,6.7,21,,,Figures by method do not add up to the total because some methods are used in combination.,,Including douching.,,,,,,,,,,National survey,,"Knowledge, Attitudes and Practices in Family Planning 1963",5416
developing,TUR ,792,Turkey,Turkey,Turkey1968,0,1968,1969,<45,MW,31.6,9.3,29.8,,,Figures by method do not add up to the total because some methods are used in combination.,,Including douching.,,,,,,,,,,National survey,,1968 Survey on Family Structure and Population Problems in Turkey,691
developing,TUR ,792,Turkey,Turkey,Turkey1973,0,1973,1974,<45,MW,36.8,11.4,25.4,,,,"Including injectables, IUD, male condoms and pills.","Including abstinence, rhythm and withdrawal.",,,,,,,,,,National survey,,1973 Survey on Population Structure and Population Problems in Turkey,117
developing,TUR ,792,Turkey,Turkey,Turkey1978,0,1978,1979,15-49,MW,50.4,17.8,32.6,,Data pertain to women exposed to the risk of pregnancy.,,,Including abstinence and douching.,,Data pertain to women exposed to the risk of pregnancy.,,,,,,,,WFS,,Turkish Fertility Survey 1978,748
developing,TUR ,792,Turkey,Turkey,Turkey1983,0,1983,1984,15-49,MW,50.6,22.4,28.2,,,Adjusted.,,Including douching and folk methods.,,,,,Including douching and folk methods.,,,,,CPS,,Turkey 1983 Population and Health Survey ,824
developing,TUR ,792,Turkey,Turkey,Turkey1988,0,1988,1989,15-49,MW,63.4,31.1,32.3,,,,Including vaginal barrier methods.,Including abstinence and douching.,,,,,,,,,,National survey,,1988 Turkish Population and Health Survey,729
developing,TUR ,792,Turkey,Turkey,Turkey1993,0,1993.58,1993.83,15-49,MW,62.6,34.5,28.1,,,,,Including abstinence and douching.,,,,,,14.6,4.4,10.2,,DHS,,Turkish Demographic and Health Survey 1993,1757
developing,TUR ,792,Turkey,Turkey,Turkey1998,0,1998.58,1998.91,15-49,MW,63.9,37.7,26.1,,,,,,,,,,,14,5,9,,DHS,,Turkish Demographic and Health Survey 1998,1756
developing,TUR ,792,Turkey,Turkey,Turkey2003,0,2003.92,2004.41,15-49,MW,71,43.1,27.9,,,,,Including folk methods.,,,,,Including folk methods.,9.5,3.1,6.4,,DHS,,Turkish Demographic and Health Survey 2003,1755
developing,TUR ,792,Turkey,Turkey,Turkey2008,0,2008,2009,15-49,MW,73,46,27,,,,,Including lactational amenorrhea (LAM) and folk methods.,,,,,Including lactational amenorrhea (LAM) and folk methods.,6.2,2.1,4.1,,National survey,,Turkish Demographic and Health Survey 2008,5184
developing,TUR ,792,Turkey,Turkey,Turkey2013,0,2013,2014,15-49,MW,73.5,47.4,26,,,,,,,,,,,5.9,2.6,3.3,,DHS,,2013 Turkey Demographic and Health Survey,5557
developing,TKM ,795,Turkmenistan,Turkmenistan,Turkmenistan2000,0,2000.5,2000.83,15-49,MW,61.8,53.1,8.7,,,Adjusted.,Including female condoms.,,,,,,,13.1,4.7,8.3,,DHS,,Turkmenistan Demographic and Health Survey 2000,1793
developing,TKM ,795,Turkmenistan,Turkmenistan,Turkmenistan2006,0,2006,2007,15-49,MW,48,46.9,1.2,,,,,Including abstinence.,,,,,,,,,,MICS3,,Turkmenistan 2006 Multiple Indicator Cluster Survey,5
developing,TUV ,798,Tuvalu,Tuvalu,Tuvalu2007,0,2007.48,2007.79,15-49,MW,30.5,22.4,8.1,,,,,Including folk methods.,,,,,Including folk methods.,24.2,12.1,12.1,,National survey,,Tuvalu Demographic and Health Survey 2007,3329
developing,UGA ,800,Uganda,Uganda,Uganda1988,0,1988.67,1989.16,15-49,MW,4.9,2.5,2.4,,,,,,,,,,,,,,,DHS,,Uganda Demographic and Health Survey 1988-1989,1804
developing,UGA ,800,Uganda,Uganda,Uganda1995,0,1995.16,1995.66,15-49,MW,14.8,7.8,7,,,,,Including folk methods.,,,,,Including folk methods.,30,18.9,11.1,,DHS,,Uganda Demographic and Health Survey 1995,1723
developing,UGA ,800,Uganda,Uganda,Uganda2000,0,2000.67,2001.24,15-49,MW,22.8,18.2,4.6,,,,,Including folk methods.,,,,,Including folk methods.,35,20.3,14.7,,DHS,,Uganda Demographic and Health Survey 2000-2001,1886
