developing,LSO ,426,Lesotho,Lesotho,Lesotho2011,0,2011.29,2011.38,Dec-49,MW,50.7,,,,,,,,,,,,,,,,,National survey,,Lesotho Demographic Survey 2011,5608
developing,LSO ,426,Lesotho,Lesotho,Lesotho2014,0,2014.67,2015,15-49,MW,60.2,59.8,0.4,,,Preliminary data.,,,,,,,,18.4,,,,DHS,,Lesotho Demographic and Health Survey 2014,5769
developing,LBR ,430,Liberia,Liberia,Liberia1986,0,1986.08,1986.58,15-49,MW,6.4,5.5,0.9,,,,,,,,,,,32.8,19.8,13,,DHS,,Liberia Demographic and Health Survey 1986,1802
developing,LBR ,430,Liberia,Liberia,Liberia2006,0,2006.92,2007.33,15-49,MW,11.4,10.3,1.2,,,,,,,,,,,35.7,24.2,11.4,,DHS,,2007 Liberia Demographic and Health Survey,647
developing,LBR ,430,Liberia,Liberia,Liberia2013,0,2013.16,2013.58,15-49,MW,20.2,19.1,1.1,,,,,,,,,,,31.1,22,9.1,,DHS,,Liberia Demographic and Health Survey 2013,5469
developing,LBY ,434,Libya,Libya,Libya1995,0,1995,1996,15-49,MW,45.2,25.7,19.6,,,,"Including female sterilization, injectables, male condoms and vaginal barrier methods.","Including breastfeeding, rhythm and withdrawal.",,,,,,,,,,PAPCHILD,,Arab Libyan Maternal and Child Survey 1995,757
developing,LBY ,434,Libya,Libya,Libya2007,0,2007.33,2007.83,15-49,MW,41.9,20.4,21.5,,,,,Including breastfeeding.,,,,,,27,20,7,,PAPFAM,,Libya Family Health Survey 2007,4527
,LTU ,440,Lithuania,Lithuania,Lithuania1994,0,1994.75,1996,18-49,MW,50.7,33.2,17.5,,,Adjusted.,,,,,,,,18,,18,,FFS,,Lithuanian Fertility and Family Survey,2841
,LTU ,440,Lithuania,Lithuania,Lithuania2006,0,2006.25,2006.99,18-49,MW,62.93619867,50.43619867,12.5,,Data pertain to women with co-resident male partner.,Including some cases of sterilization for non-contraceptive reasons.,,,,,,+,,,,,,GGS,,Lithuania 2006 Generations and Gender Survey ,5438
developing,MDG ,450,Madagascar,Madagascar,Madagascar1992,0,1992.33,1992.92,15-49,MW,16.7,5.1,11.6,,,,,,,,,,,32.3,16.2,16.2,,DHS,,Enquête Nationale Démographique et Sanitaire 1992,1708
developing,MDG ,450,Madagascar,Madagascar,Madagascar1997,0,1997.67,1998,15-49,MW,19.4,9.7,9.7,,,,,Including folk methods.,,,,,Including folk methods.,27.7,14.7,12.9,,DHS,,Enquête Démographique et de Santé Madagascar 1997,1729
developing,MDG ,450,Madagascar,Madagascar,Madagascar1999,0,1999,2000,15-49,MW,25,12.9,12.1,,,,,,,,,,,,,,,National survey,,Enquête Prioritaire auprès des Ménages 1999,3179
developing,MDG ,450,Madagascar,Madagascar,Madagascar2000,0,2000.59,2000.78,15-49,MW,18.8,12.4,6.4,,,,,,,,,,,,,,,MICS2,,Enquête à Indicateur Multiples,1891
developing,MDG ,450,Madagascar,Madagascar,Madagascar2003,0,2003.83,2004.25,15-49,MW,27.1,18.3,8.8,,,,,Including folk methods.,,,,,Including folk methods.,24.5,11.8,12.7,,DHS,,Enquête Démographique et de Santé Madagascar 2003-2004,1734
developing,MDG ,450,Madagascar,Madagascar,Madagascar2008,0,2008.84,2009.66,15-49,MW,39.9,29.2,10.7,,,,,Including folk methods.,,,,,Including folk methods.,19,10.2,8.8,,DHS,,Enquête Démographique et de Santé Madagascar 2008-2009,4691
developing,MWI ,454,Malawi,Malawi,Malawi1984,0,1984.33,1984.5,15-49,MW,6.9,3.2,3.7,,,,Including male and female sterilization and vaginal barrier methods.,Including abstinence.,,,,,,,,,,National survey,,Malawi Family Formation Survey 1984,712
developing,MWI ,454,Malawi,Malawi,Malawi1992,0,1992.67,1992.92,15-49,MW,13,7.4,5.6,,,,,,,,,,,36.5,24.3,12.2,,DHS,,Malawi Demographic and Health Survey 1992,1834
developing,MWI ,454,Malawi,Malawi,Malawi1996,0,1996.42,1996.83,15-49,MW,21.9,14.4,7.5,,,,,,,,,,,,,,,DHS,,"Malawi Knowledge, Attitudes and Practices in Health Survey 1996",4952
developing,MWI ,454,Malawi,Malawi,Malawi2000,0,2000.5,2000.92,15-49,MW,30.6,26.1,4.5,,,,,Including folk methods.,,,,,Including folk methods.,29.9,14.9,15,,DHS,,Malawi Demographic and Health Survey 2000,1833
developing,MWI ,454,Malawi,Malawi,Malawi2004,0,2004.75,2005.08,15-49,MW,32.5,28.1,4.3,,,,,,,,,,,30.3,16.2,14.1,,DHS,,Malawi Demographic and Health Survey 2004,1885
developing,MWI ,454,Malawi,Malawi,Malawi2006,0,2006.53,2006.87,15-49,MW,41,38.6,2.4,,,,,,,,,,,,,,,MICS3,,Malawi Multiple Indicator Cluster Survey 2005,1845
developing,MWI ,454,Malawi,Malawi,Malawi2010,0,2010.41,2010.91,15-49,MW,46.1,42.2,3.9,,,,,Including folk methods.,,,,,Including folk methods.,26.2,12.4,13.8,,DHS,,Malawi Demographic and Health Survey 2010,4692
developing,MWI ,454,Malawi,Malawi,Malawi2013,0,2013.83,2014.32,15-49,MW,58.6,57.4,1.2,,,,,,,,,,,19.4,12.1,7.3,,MICS4,,Malawi 2013-2014 Multiple Indicator Cluster Survey,5582
developing,MYS ,458,Malaysia,Malaysia,Malaysia1966,0,1966,1968,15-44,MW,8.7,6.2,2.5,Data pertain to Peninsular Malaysia.,,,Including male and female sterilization.,"Including abstinence, rhythm and withdrawal.",Data pertain to Peninsular Malaysia.,,,,,,,,,National survey,,West Malaysian Family Survey 1966-1967,5137
developing,MYS ,458,Malaysia,Malaysia,Malaysia1974,0,1974,1975,15-49,MW,33,23.7,9.3,Data pertain to Peninsular Malaysia.,,,,Including abstinence.,Data pertain to Peninsular Malaysia.,,,,,,,,,WFS,,The Malaysian Fertility and Family Survey 1974,16
developing,MYS ,458,Malaysia,Malaysia,Malaysia1984,0,1984,1985,15-49,MW,51.4,29.8,21.7,Data pertain to Peninsular Malaysia.,,,,Including abstinence and folk methods.,Data pertain to Peninsular Malaysia.,,,,Including abstinence and folk methods.,,,,,National survey,,Malaysian Population and Family Survey,2745
developing,MYS ,458,Malaysia,Malaysia,Malaysia1988,0,1988,1989,15-49,MW,48.3,31.4,17,Data pertain to Peninsular Malaysia.,,,"Including male and female sterilization, injectables, implants and vaginal barrier methods.",Including abstinence.,Data pertain to Peninsular Malaysia.,,,,,,,,,National survey,,Malaysian Family Life Survey II,2784
developing,MYS ,458,Malaysia,Malaysia,Malaysia1994,0,1994,1995,15-49,MW,55.1,30.4,24.7,Data pertain to Peninsular Malaysia.,,Adjusted.,Including male and female sterilization.,Including abstinence.,Data pertain to Peninsular Malaysia.,,,,,,,,,National survey,,Malaysian Population and Family Survey,2842
developing,MYS ,458,Malaysia,Malaysia,Malaysia2004,0,2004.5,2004.83,15-49,MW,49,32.3,16.7,Data pertain to Peninsular Malaysia.,,Adjusted.,Including male and female sterilization.,Including abstinence.,Data pertain to Peninsular Malaysia.,,,,,,,,,National survey,,Malaysian Population and Family Survey,3184
developing,MYS ,458,Malaysia,Malaysia,Malaysia2014,0,2014.67,2015.08,15-49,MW,52.2,34.3,17.9,,,,"Including male sterilization, emergency contraception, contraceptive patch, and contraceptive ring.",Including abstinence and breastfeeding.,,,,,,,,,,National survey,,Malaysian Population and Family Survey,5770
developing,MDV ,462,Maldives,Maldives,Maldives1991,0,1991,1992,15-49,MW,29,19,10,,,Adjusted. Figures by method do not add up to total.,,Including rhythm and withdrawal.,,,,,,,,,,National survey,,KAP Survey on Child Spacing Methods in Maldives 1991,2812
developing,MDV ,462,Maldives,Maldives,Maldives1999,0,1999,2000,15-49,MW,42,33,9,,,Figures by method do not add up to the total.,,Including rhythm and withdrawal.,,,,,,,,,,National survey,,Republic of Maldives Reproductive Health Baseline Survey 1999,2889
developing,MDV ,462,Maldives,Maldives,Maldives2004,0,2004,2005,15-49,MW,39,34,5,,,Figures by method do not add up to the total.,,Including rhythm and withdrawal.,,,,,,,,,,National survey,,Republic of Maldives Reproductive Health Survey 2004,2936
developing,MDV ,462,Maldives,Maldives,Maldives2009,0,2009,2009.83,15-49,MW,34.7,27,7.8,,,,,Including folk methods.,,,,,Including folk methods.,28.6,15,13.6,,DHS,,Maldives Demographic and Health Suvery 2009,4699
developing,MLI ,466,Mali,Mali,Mali1987,0,1987.16,1987.66,15-49,MW,4.7,1.3,3.4,,,,,Including abstinence and folk methods.,,,,,Including abstinence and folk methods.,22.9,17.2,5.7,,DHS,,Enquête Démographique et de Santé au Mali 1987,1784
developing,MLI ,466,Mali,Mali,Mali1995,0,1995.83,1996.41,15-49,MW,6.7,4.5,2.2,,,,"Including male sterilization, implants and vaginal barrier methods.",Including folk methods.,,,,,Including folk methods.,27.5,21,6.5,,DHS,,Enquête Démographique et de Santé au Mali 1995-1996,1715
developing,MLI ,466,Mali,Mali,Mali2001,0,2001,2001.41,15-49,MW,8.1,6.9,1.1,,,,,Including folk methods.,,,,,Including folk methods.,29.6,21.5,8.2,,DHS,,Enquête Démographique et de Santé au Mali 2001,1714
developing,MLI ,466,Mali,Mali,Mali2006,0,2006.33,2007,15-49,MW,8.2,6.9,1.4,,,,,Including folk methods.,,,,,Including folk methods.,27.6,20.3,7.3,,DHS,,Enquête Démographique et de Santé au Mali 2006,1682
developing,MLI ,466,Mali,Mali,Mali2012,0,2012.84,2013.16,15-49,MW,10.3,9.9,0.5,,,,,,,,,,,26,18.6,7.4,,DHS,,Enquête Démographique et de Santé du Mali EDSM-V 2012-2013,5460
,MLT ,470,Malta,Malta,Malta1971,0,1971,1972,20-45,MW,87,16,,,Data pertain to married women who visited a practitioner belonging to the Malta College of Family Doctors.,Figures by method do not add up to the total because some methods are used in combination.,,Including abstinence.,,,,,,,,,,National survey,,1971 Survey of Family Planning in Malta ,5140
,MLT ,470,Malta,Malta,Malta1993,0,1993,1994,20-45,MW,85.8,46,,,Data pertain to married women who visited a practitioner belonging to the Malta College of Family Doctors.,Figures by method do not add up to the total because some methods are used in combination.,,Including abstinence.,,,,,,,,,,National survey,,1993 Survey of Family Planning in Malta ,3204
developing,MHL ,584,Marshall Islands,Marshall Islands,Marshall Islands1970,0,1970,1971,15-49,AL,22.7,18.1,4.6,,"Data pertain to all women of reproductive age, irrespective of marital status.",,Including male and female sterilization.,"Including abstinence, folk methods and withdrawal.",,,,,"Including abstinence, folk methods and withdrawal.",,,,,National survey,,"Knowledge, Attitude and Practice of Contraception Survey in the Trust Territory of the Pacific Islands 1970",3253
developing,MHL ,584,Marshall Islands,Marshall Islands,Marshall Islands1985,0,1985,1986,15-49,AL,27.2,19.4,7.8,,"Data pertain to all women of reproductive age, irrespective of marital status.",,,,,,,,,,,,,National survey,,Women's Health Survey 1985,3255
developing,MHL ,584,Marshall Islands,Marshall Islands,Marshall Islands2007,0,2007.1,2007.43,15-49,MW,44.6,42.4,2.2,,,,,Including folk methods.,,,,,Including folk methods.,8.1,3,5.1,,National survey,,Marshall Islands Demographic and Health Survey 2007,3259
developing,MTQ ,474,Martinique,Martinique,Martinique1976,0,1976,1977,15-49,AL,35.5,27.3,8.2,,"Data pertain to all women of reproductive age, irrespective of marital status.",,Including male sterilization and injectables.,Including douching.,,,,,,,,,,National survey,,Enquête sur la Fécondité et la Contraception en Martinique 1976,3207
developing,MRT ,478,Mauritania,Mauritania,Mauritania1981,0,1981.25,1981.91,15-49,MW,0.8,0.3,0.5,,,,,,,,,,,,,,,WFS,,Enquête Nationale Mauritanienne sur la Fécondité,183
developing,MRT ,478,Mauritania,Mauritania,Mauritania1990,0,1990,1992,15-49,MW,4.1,1.2,3.9,,,Figures by method do not add up to the total.,,Including breastfeeding.,,,,,,,,,,PAPCHILD,,Mauritania Maternal and Child Health Survey,37
developing,MRT ,478,Mauritania,Mauritania,Mauritania2000,0,2000.58,2001.33,15-49,MW,8,5.4,2.5,,,,"Including male and female sterilization, female condoms, implants and vaginal barrier methods.",,,,,,,32.1,23.2,8.9,,DHS,,Enquête Démographique et de Santé Mauritanie 2000-2001,1853
developing,MRT ,478,Mauritania,Mauritania,Mauritania2007,0,2007.33,2007.75,15-49,MW,9.3,8,1.3,,,Adjusted.,,,,,,,,,,,,MICS3,,Enquête par grappes à indicateurs multiples de la Mauritanie,2443
developing,MRT ,478,Mauritania,Mauritania,Mauritania2011,0,2011.47,2011.77,15-49,MW,11.4,10.1,1.4,,,,,,,,,,,31.1,21,10,,MICS4,,MAURITANIE Suivi de la situation des femmes et des enfants Enquête par Grappes à Indicateurs Multiples 2011,5012
developing,MUS ,480,Mauritius,Mauritius,Mauritius1975,0,1975,1976,<50,EM,45.7,29.2,16.4,,Data pertain to ever-married women of reproductive age.,,Excluding male and female sterilization.,Including abstinence.,,,,-,,,,,,National survey,,National Survey on Contraceptive Use,5141
developing,MUS ,480,Mauritius,Mauritius,Mauritius1985,0,1985.53,1985.74,15-49,MW,74.6,44.2,30.6,,,Adjusted. Figures by method do not add up to the total.,,,,,,,,,,,,CPS,,Mauritius Contraceptive Prevalence Survey 1985,2753
developing,MUS ,480,Mauritius,Mauritius,Mauritius1991,0,1991.25,1991.66,15-44,MW,74.6,49.2,25.4,,,Adjusted.,,,,,,,,6.4,1,5,,CPS,,Mauritius Contraceptive Prevalence Survey 1991,2813
developing,MUS ,480,Mauritius,Mauritius,Mauritius2002,0,2002,2003,15-49,MW,75.8,39.3,36.5,,,Adjusted.,,,,,,,,3.5,,,,National survey,,2002 Contraceptive Prevalence Survey of Mauritius and Rodrigues Islands,2924
developing,MUS ,480,Mauritius,Mauritius,Mauritius2014,0,2014.53,2014.7,15-49,MW,63.8,31.1,32.7,,,Preliminary data.,,,,,,,,12.5,4.1,8.4,,CPS,,Mauritius 2014 Contraceptive Prevalence Survey,5970
developing,MEX ,484,Mexico,Mexico,Mexico1976,0,1976.54,1977.2,15-49,MW,30.3,23.3,7.1,,,,,Including douching.,,,,,,,,,,WFS,,Encuesta Mexicana de Fecundidad 1976-1977,110
developing,MEX ,484,Mexico,Mexico,Mexico1978,0,1978.5,1978.83,15-49,MW,40,32.8,7.3,,,Data for methods pertain to all women regardless of marital status.,,,,,,,,,,,,CPS,,Mexico 1978 Encuesta Nacional de Prevalencia en el Uso de Métodos Anticonceptivos,418
developing,MEX ,484,Mexico,Mexico,Mexico1979,0,1979.7,1980,15-49,MW,37.8,32,5.7,,,,Including male condoms and vaginal barrier methods.,Including rhythm and withdrawal.,,,,,,,,,,CPS,,Encuesta Nacional de Prevalecía en el Uso de Métodos Anticonceptivos 1979,128
developing,MEX ,484,Mexico,Mexico,Mexico1982,0,1982,1983,15-49,MW,47.7,41.5,6.1,,,,Including condoms and vaginal barrier methods.,"Including rhythm, withdrawal, folk methods and herbs.",,,,,"Including rhythm, withdrawal, folk methods and herbs.",,,,,National survey,,Encuesta Nacional Demográfica 1982,2727
developing,MEX ,484,Mexico,Mexico,Mexico1987,0,1987.08,1987.41,15-49,MW,52.7,44.6,8.1,,,,,"Including breastfeeding, rhythm and withdrawal.",,,,,,25.1,12.1,13,,DHS,,Encuesta Nacional sobre Fecundidad y Salud 1987,1733
developing,MEX ,484,Mexico,Mexico,Mexico1992,0,1992.67,1992.92,15-49,MW,63.1,55.2,7.9,,,,"Including male and female sterilization, injectables and implants.",,,,,,,,,,,National survey,,Encuesta Nacional de la Dinámica Demográfica 1992,46
developing,MEX ,484,Mexico,Mexico,Mexico1995,0,1995.81,1995.88,15-49,MW,66.5,57.5,8.9,,,,Including male condoms and vaginal barrier methods.,Including rhythm and withdrawal.,,,,,,16.1,7.2,8.9,,National survey,,Encuesta Nacional de Planificación Familiar 1995,1151
developing,MEX ,484,Mexico,Mexico,Mexico1997,0,1997.68,1997.95,15-49,MW,68.4,59.5,8.9,,,,"Including male and female sterilization, injectables and implants.",,,,,,,12.1,6.9,5.2,,National survey,,Encuesta Nacional de la Dinámica Demográfica 1997,688
developing,MEX ,484,Mexico,Mexico,Mexico2003,0,2003,2004,15-49,MW,74.5,69.3,5.2,,,,"Including male and female sterilization, injectables and implants.",,,,,,,9.9,5.1,4.8,,National survey,,Encuesta Nacional de Salud Reproductiva 2003,2931
developing,MEX ,484,Mexico,Mexico,Mexico2006,0,2006,2007,15-49,MW,70.9,66.5,4.4,,,,Including male and female sterilization.,,,,,,,12,6.2,5.7,,National survey,,Encuesta Nacional de la Dinámica Demográfica 2006,2947
developing,MEX ,484,Mexico,Mexico,Mexico2009,0,2009.38,2009.52,15-49,MW,72.5,67.4,5.1,,,,"Including male and female sterilization, pills, injectables, IUD, male condoms and vaginal barrier methods.","Including lactational amenorrhea (LAM), rhythm and withdrawal.",,,,,,9.8,5.2,4.6,,National survey,,Encuesta Nacional de la Dinámica Demográfica 2009,5550
developing,MEX ,484,Mexico,Mexico,Mexico2014,0,2014.59,2014.73,15-49,MW,72.3,68.4,3.9,,,,Excluding male and female sterilization and male condoms.,"Including lactational amenorrhea (LAM), rhythm and withdrawal.",,,,-,,,,,,ENADID,,Mexico 2014 Encuesta Nacional de la Dinámica Demográfica,5734
developing,MNG ,496,Mongolia,Mongolia,Mongolia1994,0,1994,1995,15-49,MW,57.3,41.2,16.1,,,,,Including douching.,,,,,,,,,,National survey,,Mongolia Demographic Survey 1994,744
developing,MNG ,496,Mongolia,Mongolia,Mongolia1998,0,1998,1999,15-49,MW,59.9,45.7,14.3,,,,,,,,,,,9.9,2.9,6.9,,National survey,,Mongolia Reproductive Health Survey 1998,675
developing,MNG ,496,Mongolia,Mongolia,Mongolia2000,0,2000.38,2000.61,15-49,MW,67.4,59.1,8.3,,,,,,,,,,,,,,,MICS2,,Mongolia Multiple Indicator Cluster Survey,1916
developing,MNG ,496,Mongolia,Mongolia,Mongolia2003,0,2003,2004,15-49,MW,69,58.4,10.6,,,,,,,,,,,4.6,2,2.6,,National survey,,Mongolia Reproductive Health Survey 2003,677
developing,MNG ,496,Mongolia,Mongolia,Mongolia2005,0,2005.83,2006,15-49,MW,66,61.1,4.9,,,,,,,,,,,,,,,MICS3,,Mongolia Multiple Indicator Cluster Survey 2005-2006,832
developing,MNG ,496,Mongolia,Mongolia,Mongolia2008,0,2008,2009,15-49,MW,55.2,49.6,5.5,,,Figures by method do not add up to the total.,,,,,,,,14.4,13.7,0.7,,National survey,,Mongolia Reproductive Health Survey 2008,4566
developing,MNG ,496,Mongolia,Mongolia,Mongolia2010,0,2010.59,2010.63,15-49,MW,54.9,50.4,4.5,,,,,,,,,,,22.3,5.9,16.5,,MICS,,Mongolia 2010 Multiple Indicator Cluster Survey,5014
developing,MNG ,496,Mongolia,Mongolia,Mongolia2013,0,2013.75,2013.99,15-49,MW,54.6,48.2,6.4,,,Figures by method do not add up to the total.,,,,,,,,16,6.8,9.3,,MICS5,,Mongolia 2013 Multiple Indicator Cluster Survey,5579
,MNE,499,Montenegro,Montenegro,Montenegro1970,0,1970,1971,15-44,AL,49.5,7,42.5,,"Data pertain to all women of reproductive age, irrespective of marital status.",Data pertain to methods used during  the last two months.,,,,,,,,,,,,National survey,,1970 Yugoslavia Fertility Survey,3222
,MNE,499,Montenegro,Montenegro,Montenegro2000,0,2000.47,2000.55,15-49,MW,52.7,30.7,22,,,Adjusted.,,,,,,,,,,,,MICS2,,Multiple Indicator Cluster Survey II,4451
,MNE,499,Montenegro,Montenegro,Montenegro2005,0,2005.75,2006.08,15-49,MW,39.4,17.4,22,,,Figures by method do not add up to the total.,,,,,,,,,,,,MICS3,,Montenegro Multiple Indicator Cluster Survey 2005,2456
,MNE,499,Montenegro,Montenegro,Montenegro2013,0,2013.16,2013.41,15-49,MW,23.3,15.4,7.8,,,,,,,,,,,21.8,11.1,10.8,,MICS5,,Montenegro  Multiple Indicator Cluster Survey 2013,5015
developing,MSR ,500,Montserrat,Montserrat,Montserrat1984,0,1984,1985,15-44,MW,52.6,52.2,0.3,,,,Including male and female sterilization.,Including rhythm and withdrawal.,,,,,,,,,,CCPS,,Caribbean Contraceptive Prevalence Survey,2746
developing,MAR ,504,Morocco,Morocco,Morocco1979,0,1979,1981,15-49,MW,19.4,16.4,3,,,,,,,,,,,,,,,WFS,,Enquête Nationale sur la Fécondité et la Planification Familiale au Maroc,771
developing,MAR ,504,Morocco,Morocco,Morocco1983,0,1983,1985,15-49,MW,25.5,21.2,4.3,,,,,Including abstinence and douching.,,,,,,,,,,CPS,,Enquête Nationale de Prévalence Contraceptive,642
developing,MAR ,504,Morocco,Morocco,Morocco1987,0,1987.33,1987.58,15-49,MW,35.9,28.9,6.9,,,,,Including abstinence and douching.,,,,,,22.1,12.5,9.6,,DHS,,"Enquête Nationale sur la Planification Familiale, la Fécondité et la Santé de la Population au Maroc 1987",1796
developing,MAR ,504,Morocco,Morocco,Morocco1992,0,1992,1992.33,15-49,MW,41.5,35.5,6,,,,,,,,,,,23.5,9.6,13.9,,DHS,,Enquête Nationale sur la Population et la Santé au Maroc 1992,1797
developing,MAR ,504,Morocco,Morocco,Morocco1995,0,1995.25,1995.41,15-49,MW,50.3,42.4,7.9,,,,,,,,,,,16.1,6.3,9.8,,DHS,,Enquête de Panel sur la Population et la Santé 1995,695
developing,MAR ,504,Morocco,Morocco,Morocco1997,0,1997.67,1998,15-49,MW,58.4,48.8,9.6,,,,Including male sterilization.,Including breastfeeding.,,,,,,,,,,PAPCHILD,,Enquête Nationale sur la Santé de la Mère et de l'Enfant au Maroc 1997,204
developing,MAR ,504,Morocco,Morocco,Morocco2003,0,2003.75,2004.16,15-49,MW,63,54.8,8.2,,,,,Including folk methods.,,,,,Including folk methods.,11.9,4.4,7.4,,DHS,,Enquête sur la Population et la Santé Familiale 2003-2004,1866
developing,MAR ,504,Morocco,Morocco,Morocco2010,0,2010.83,2011.24,15-49,MW,67.4,58.6,8.8,,,,,,,,,,,10.9,4.2,6.7,,PAPFAM,,Enquête Nationale sur la Population et la Santé Familiale,5353
developing,MOZ ,508,Mozambique,Mozambique,Mozambique1997,0,1997.16,1997.58,15-49,MW,5.6,5.1,0.5,,,,,Including folk methods.,,,,,Including folk methods.,24.9,18.7,6.3,,DHS,,Moçambique Inquérito Demográfico e de Saúde 1997,1767
developing,MOZ ,508,Mozambique,Mozambique,Mozambique2003,0,2003.58,2004.08,15-49,MW,25.5,20.8,4.7,,,,,Including folk methods.,,,,,Including folk methods.,18.9,10.9,8,,DHS,,Moçambique Inquérito Demográfico e de Saúde 2003,1758
developing,MOZ ,508,Mozambique,Mozambique,Mozambique2008,0,2008.58,2008.92,15-49,MW,16.2,14.7,1.5,,,,,,,,,,,,,,,MICS3,,Mozambique Multiple Indicator Cluster Survey 2008,4871
developing,MOZ ,508,Mozambique,Mozambique,Mozambique2011,0,2011.41,2011.91,15-49,MW,11.6,11.3,0.3,,,,,,,,,,,28.5,15.6,12.9,,DHS,,Moçambique Inquérito Demográfico e de Saúde 2011,5064
developing,MMR ,104,Myanmar,Myanmar,Myanmar1991,0,1991,1992,15-49,MW,16.8,13.6,3.2,,,Adjusted.,,,,,,,,20.6,6.2,14.4,,National survey,,Myanmar Population Changes and Fertility Survey 1991,195
developing,MMR ,104,Myanmar,Myanmar,Myanmar1997,0,1997.16,1997.41,15-49,MW,32.7,28.3,4.4,,,Adjusted.,,,,,,,,19.1,5.8,13.3,,National survey,,Myanmar Fertility and Reproductive Health Survey 1997,638
developing,MMR ,104,Myanmar,Myanmar,Myanmar2001,0,2001,2002,15-49,MW,37,32.8,4.2,,,,,,,,,,,19.1,6.3,12.8,,National survey,,Myanmar Fertility and Reproductive Health Survey 2001,816
developing,MMR ,104,Myanmar,Myanmar,Myanmar2007,0,2007.5,2007.02,15-49,MW,41,38.4,2.6,,,,,,,,,,,,,,,National survey,,Myanmar Fertility and Reproductive Health Survey 2007,5142
developing,MMR ,104,Myanmar,Myanmar,Myanmar2009,0,2009.75,2010.24,15-49,EM,46,45.8,0.3,,Data pertain to ever-married women of reproductive age.,Figures by method do not add up to the total.,,,,,,,,,,,,MICS3,,Myanmar 2009-2010 Multiple Indicator Cluster Survey,5016
developing,NAM ,516,Namibia,Namibia,Namibia1989,0,1989,1990,<50,AL,40.9,32.1,8.8,,Data pertain to non-pregnant women.,Adjusted.,,Including breastfeeding.,,Data pertain to non-pregnant women.,,,,,,,,National survey,,Southern African Demographic and Health Survey,5143
developing,NAM ,516,Namibia,Namibia,Namibia1992,0,1992.5,1992.92,15-49,MW,28.9,26,2.9,,,,,Including folk methods.,,,,,Including folk methods.,21.8,14.6,7.1,,DHS,,Namibia Demographic and Health Survey 1992,1799
developing,NAM ,516,Namibia,Namibia,Namibia2000,0,2000.67,2001,15-49,MW,43.7,42.6,1.1,,,Figures by method do not add up to the total.,,,,,,,,23.9,9.9,14,,DHS,,Namibia Demographic and Health Survey 2000,1807
developing,NAM ,516,Namibia,Namibia,Namibia2006,0,2006.83,2007.24,15-49,MW,55.1,53.5,1.6,,,,,Including folk methods.,,,,,Including folk methods.,20.7,8.6,12.1,,DHS,,2006-2007 Namibia Demographic and Health Survey,43
developing,NAM ,516,Namibia,Namibia,Namibia2013,0,2013.33,2013.75,15-49,MW,56.1,55.3,0.8,,,Figures by method do not add up to the total.,Including contraceptive patch.,,,,,,,17.5,9.1,8.4,,DHS,,Namibia 2013 Demographic and Health Survey,5616
developing,NRU ,520,Nauru,Nauru,Nauru2007,0,2007.61,2007.76,15-49,MW,35.6,25.1,10.5,,,,,Including folk methods.,,,,,Including folk methods.,23.5,16.4,7.1,,National survey,,Nauru Demographic and Health Survey 2007,3228
developing,NPL ,524,Nepal,Nepal,Nepal1976,0,1976.25,1976.5,15-49,MW,2.4,2.4,,,,,,,,,,,,,,,,WFS,,The Nepal Fertility Survey 1976,818
developing,NPL ,524,Nepal,Nepal,Nepal1981,0,1981.07,1981.47,15-49,MW,6.8,6.8,,,,,,,,,,,,,,,,CPS,,Nepal 1981 Contraceptive Prevalence Survey,681
developing,NPL ,524,Nepal,Nepal,Nepal1985,0,1985,1987,15-49,MW,15.1,15.1,,,Data pertain to non-pregnant women.,,,,,Data pertain to non-pregnant women.,,,,,,,,National survey,,Nepal Fertility and Family Planning Survey 1986,781
developing,NPL ,524,Nepal,Nepal,Nepal1991,0,1991.58,1992.08,15-49,MW,24.1,24.1,,,Data pertain to non-pregnant women.,,,,,Data pertain to non-pregnant women.,,,,27.7,12.4,15.3,,National survey,,"Nepal Fertility, Family Planning and Health Survey 1991",13
developing,NPL ,524,Nepal,Nepal,Nepal1996,0,1996,1996.5,15-49,MW,28.5,26,2.5,,,,,,,,,,,32.4,14.8,17.5,,DHS,,Nepal Family Health Survey 1996,1801
developing,NPL ,524,Nepal,Nepal,Nepal2000,0,2000.18,2000.41,15-49,MW,37.3,37.1,0.2,,Data pertain to non-pregnant women.,,,,,Data pertain to non-pregnant women.,,,,,,,,National survey,,"Between Census Household Information, Monitoring and Evaluation System 2000",3229
developing,NPL ,524,Nepal,Nepal,Nepal2001,0,2001,2001.49,15-49,MW,39.3,35.4,3.9,,,Figures by method do not add up to the total.,,Including folk methods.,,,,,Including folk methods.,27.8,11.1,16.7,,DHS,,Nepal Demographic and Health Survey 2001,1800
developing,NPL ,524,Nepal,Nepal,Nepal2003,0,2003,2005,15-49,MW,38.3,37.9,0.4,,,,"Including injectables, implants, IUD, pills and vaginal barrier methods.",,,,,,,,,,,LSMS,,Nepal Living Standards Survey 2003-2004,2932
developing,NPL ,524,Nepal,Nepal,Nepal2006,0,2006.08,2006.66,15-49,MW,48,44.2,3.7,,,,,Including folk methods.,,,,,Including folk methods.,24.7,9.3,15.4,,DHS,,Nepal Demographic and Health Survey 2006,1851
developing,NPL ,524,Nepal,Nepal,Nepal2011,0,2011,2011.49,15-49,MW,49.7,43.2,6.5,,,,,,,,,,,27.5,9.9,17.6,,DHS,,Nepal Demographic and Health Survey (NDHS) 2011,5065
developing,NPL ,524,Nepal,Nepal,Nepal2014,0,2014.08,2014.49,15-49,MW,49.6,47.1,2.5,,,,,,,,,,,,,,,MICS,,Nepal 2014 Multiple Indicator Cluster Survey,5672
,NLD ,528,Netherlands,Netherlands,Netherlands1969,0,1969,1970,See notes,MW,59,41.6,17.5,,"Data pertain to women who married in 1958, 1963 and 1968.",Adjusted.,Excluding male and female sterilization.,,,,,-,,,,,,National survey,,National Fertility Survey of 1969,5144
